{
  "requiredStringField": "requiredStringValue",
  "requiredArray": [
    "requiredArrayValue1",
    "requiredArrayValue2",
    "requiredArrayValue3"
  ],
  "phoneNumberField": "0123456789",
  "dateField": "2020-01-01",
  "emailField": "email@domain.com",
  "datetimeField": "2022-09-27T08:25:54+02:00"
}